{
  "$schema": "https://json-schema.org/draft/2020-12/schema",
  "$id": "https://helix.local/schemas/conversation-role-registry.schema.json",
  "title": "HELIX conversation-role registry",
  "type": "object",
  "additionalProperties": false,
  "required": [
    "schema_version",
    "updated_on",
    "authority_model",
    "roles"
  ],
  "properties": {
    "schema_version": {
      "const": "helix.conversation-role-registry.v1"
    },
    "updated_on": {
      "type": "string",
      "format": "date"
    },
    "authority_model": {
      "type": "object",
      "additionalProperties": false,
      "required": [
        "source_precedence",
        "conflict_rule",
        "title_application"
      ],
      "properties": {
        "source_precedence": {
          "type": "array",
          "minItems": 5,
          "uniqueItems": true,
          "items": {
            "type": "string",
            "minLength": 1
          }
        },
        "conflict_rule": {
          "type": "string",
          "minLength": 1
        },
        "title_application": {
          "const": "manual_chatgpt_workspace_action"
        }
      }
    },
    "roles": {
      "type": "array",
      "minItems": 1,
      "items": {
        "$ref": "#/$defs/role"
      }
    }
  },
  "$defs": {
    "nullableString": {
      "type": [
        "string",
        "null"
      ]
    },
    "target": {
      "type": "object",
      "additionalProperties": false,
      "required": [
        "repository",
        "branch",
        "pull_request",
        "head_sha"
      ],
      "properties": {
        "repository": {
          "$ref": "#/$defs/nullableString"
        },
        "branch": {
          "$ref": "#/$defs/nullableString"
        },
        "pull_request": {
          "type": [
            "integer",
            "null"
          ],
          "minimum": 1
        },
        "head_sha": {
          "anyOf": [
            {
              "type": "string",
              "pattern": "^[0-9a-f]{40}$"
            },
            {
              "type": "null"
            }
          ]
        }
      }
    },
    "lifecycle": {
      "type": "object",
      "additionalProperties": false,
      "required": [
        "proposed",
        "implemented",
        "ci_verified",
        "merged",
        "deployed",
        "operationally_verified"
      ],
      "properties": {
        "proposed": {
          "type": "boolean"
        },
        "implemented": {
          "type": "boolean"
        },
        "ci_verified": {
          "type": "boolean"
        },
        "merged": {
          "type": "boolean"
        },
        "deployed": {
          "type": "boolean"
        },
        "operationally_verified": {
          "type": "boolean"
        }
      }
    },
    "evidence": {
      "type": "object",
      "additionalProperties": false,
      "required": [
        "source_kind",
        "evidence_strength",
        "repository",
        "observed_ref",
        "observed_on"
      ],
      "properties": {
        "source_kind": {
          "type": "string",
          "minLength": 1
        },
        "evidence_strength": {
          "type": "string",
          "minLength": 1
        },
        "repository": {
          "type": "string",
          "pattern": "^[^/]+/[^/]+$"
        },
        "observed_ref": {
          "type": "string",
          "minLength": 1
        },
        "observed_on": {
          "type": "string",
          "format": "date"
        }
      }
    },
    "role": {
      "type": "object",
      "additionalProperties": false,
      "required": [
        "role_id",
        "desired_chat_title",
        "role_type",
        "authority_state",
        "owned_repository",
        "owned_branch",
        "target",
        "current_status",
        "allowed_actions",
        "prohibited_actions",
        "lifecycle",
        "evidence"
      ],
      "properties": {
        "role_id": {
          "type": "string",
          "pattern": "^[a-z0-9]+(?:-[a-z0-9]+)*$"
        },
        "desired_chat_title": {
          "type": "string",
          "pattern": "^\\[(OWNER|REVIEW|CONTROL|UNRESOLVED|DESIGN|BACKLOG|ARCHIVE|REFERENCE)\\] .+$"
        },
        "role_type": {
          "enum": [
            "control_tower",
            "write_owner",
            "independent_reviewer",
            "unresolved_owner",
            "superseded_reference",
            "design_reference",
            "backlog",
            "ui_reference"
          ]
        },
        "authority_state": {
          "enum": [
            "coordination_only",
            "confirmed",
            "review_only",
            "unresolved",
            "handed_off",
            "none"
          ]
        },
        "current_conversation_label": {
          "type": "string",
          "minLength": 1
        },
        "owned_repository": {
          "$ref": "#/$defs/nullableString"
        },
        "owned_branch": {
          "$ref": "#/$defs/nullableString"
        },
        "target": {
          "$ref": "#/$defs/target"
        },
        "current_status": {
          "type": "string",
          "minLength": 1
        },
        "allowed_actions": {
          "type": "array",
          "minItems": 1,
          "uniqueItems": true,
          "items": {
            "type": "string",
            "minLength": 1
          }
        },
        "prohibited_actions": {
          "type": "array",
          "minItems": 1,
          "uniqueItems": true,
          "items": {
            "type": "string",
            "minLength": 1
          }
        },
        "lifecycle": {
          "$ref": "#/$defs/lifecycle"
        },
        "evidence": {
          "$ref": "#/$defs/evidence"
        }
      }
    }
  }
}
