{
  "schema_version": "helix.conversation-role-registry.v1",
  "updated_on": "2026-07-21",
  "authority_model": {
    "source_precedence": [
      "live_github_metadata",
      "active_branch_project_state",
      "merged_main_state",
      "helix_conversation_role_registry",
      "chat_title_memory_or_informal_claim"
    ],
    "conflict_rule": "Report conflicts and defer to the highest-precedence current source. Never let a chat title grant authority.",
    "title_application": "manual_chatgpt_workspace_action"
  },
  "roles": [
    {
      "role_id": "helix-control-tower",
      "desired_chat_title": "[CONTROL] HELIX — Coordination & Reality",
      "role_type": "control_tower",
      "authority_state": "confirmed",
      "owned_repository": "anthonyedgar30000/HELIX30000",
      "owned_branch": "feature/conversation-role-registry-v0.1",
      "target": {
        "repository": "anthonyedgar30000/HELIX30000",
        "branch": "feature/conversation-role-registry-v0.1",
        "pull_request": null,
        "head_sha": null
      },
      "current_status": "conversation_role_registry_implementation_in_progress",
      "allowed_actions": [
        "repository_read",
        "repository_write_declared_scope",
        "pull_request_create",
        "cross_repository_read_only_lookup",
        "review_and_handoff"
      ],
      "prohibited_actions": [
        "pull_request_merge",
        "external_repository_write",
        "chat_ui_rename",
        "cloud_mutation",
        "credential_use"
      ],
      "lifecycle": {
        "proposed": true,
        "implemented": true,
        "ci_verified": false,
        "merged": false,
        "deployed": false,
        "operationally_verified": false
      },
      "evidence": {
        "source_kind": "repository_active_work",
        "evidence_strength": "authoritative_for_this_repository",
        "repository": "anthonyedgar30000/HELIX30000",
        "observed_ref": "feature/conversation-role-registry-v0.1:.project/active-work.json",
        "observed_on": "2026-07-21"
      }
    },
    {
      "role_id": "servicetracer-pr27-owner",
      "desired_chat_title": "[OWNER] ServiceTracer — PR #27 Rollback Design",
      "role_type": "write_owner",
      "authority_state": "confirmed",
      "current_conversation_label": "ServiceTracer — Governed Azure Operations Lab",
      "owned_repository": "anthonyedgar30000/azure-iac-msp-lab",
      "owned_branch": "design/collector-rollback-snapshot-recreation",
      "target": {
        "repository": "anthonyedgar30000/azure-iac-msp-lab",
        "branch": "design/collector-rollback-snapshot-recreation",
        "pull_request": 27,
        "head_sha": "bad79ac2a8ba8fa9568737fc3c3635b93f2dbaca"
      },
      "current_status": "draft_ci_verified_independent_review_changes_requested",
      "allowed_actions": [
        "repository_read",
        "repository_write_declared_scope",
        "address_review_findings",
        "request_fresh_ci"
      ],
      "prohibited_actions": [
        "pull_request_merge",
        "workflow_activation",
        "azure_authentication",
        "azure_mutation",
        "budget_or_alert_mutation"
      ],
      "lifecycle": {
        "proposed": true,
        "implemented": true,
        "ci_verified": true,
        "merged": false,
        "deployed": false,
        "operationally_verified": false
      },
      "evidence": {
        "source_kind": "active_branch_project_state",
        "evidence_strength": "authoritative_for_branch_ownership",
        "repository": "anthonyedgar30000/azure-iac-msp-lab",
        "observed_ref": "design/collector-rollback-snapshot-recreation:.project/active-work.json#workstreams[collector-rollback-snapshot-recreation]",
        "observed_on": "2026-07-21"
      }
    },
    {
      "role_id": "servicetracer-pr27-reviewer",
      "desired_chat_title": "[REVIEW] HELIX — PR #27 Operations & Recovery",
      "role_type": "independent_reviewer",
      "authority_state": "review_only",
      "owned_repository": null,
      "owned_branch": null,
      "target": {
        "repository": "anthonyedgar30000/azure-iac-msp-lab",
        "branch": "design/collector-rollback-snapshot-recreation",
        "pull_request": 27,
        "head_sha": "bad79ac2a8ba8fa9568737fc3c3635b93f2dbaca"
      },
      "current_status": "independent_review_submitted_request_changes",
      "allowed_actions": [
        "repository_read",
        "ci_inspection",
        "independent_review",
        "review_comment",
        "implementation_handoff"
      ],
      "prohibited_actions": [
        "repository_write",
        "branch_ownership_claim",
        "pull_request_merge",
        "workflow_activation",
        "azure_mutation"
      ],
      "lifecycle": {
        "proposed": true,
        "implemented": true,
        "ci_verified": true,
        "merged": false,
        "deployed": false,
        "operationally_verified": false
      },
      "evidence": {
        "source_kind": "github_review_submission",
        "evidence_strength": "authoritative_for_review_decision",
        "repository": "anthonyedgar30000/azure-iac-msp-lab",
        "observed_ref": "pull/27#pullrequestreview-4749099206",
        "observed_on": "2026-07-21"
      }
    },
    {
      "role_id": "helix-protocol-kernel-pr4-owner",
      "desired_chat_title": "[OWNER] HELIX — Protocol Kernel & Interoperability",
      "role_type": "write_owner",
      "authority_state": "confirmed",
      "current_conversation_label": "HELIX — Governed Agent Engineering / Protocol Kernel and Agent Interoperability conversation",
      "owned_repository": "anthonyedgar30000/helix-protocol-kernel",
      "owned_branch": "feature/edge-envelope-v0.3",
      "target": {
        "repository": "anthonyedgar30000/helix-protocol-kernel",
        "branch": "feature/edge-envelope-v0.3",
        "pull_request": 4,
        "head_sha": "28ad96e63baf6e3cc5e5d5a0059bb56f7ec227f3"
      },
      "current_status": "draft_exact_head_ci_verified_independent_re_review_pending",
      "allowed_actions": [
        "repository_read",
        "repository_write_declared_scope",
        "address_review_findings",
        "request_fresh_ci"
      ],
      "prohibited_actions": [
        "pull_request_merge",
        "protocol_adapter_runtime_implementation",
        "credential_use",
        "cloud_mutation"
      ],
      "lifecycle": {
        "proposed": true,
        "implemented": true,
        "ci_verified": true,
        "merged": false,
        "deployed": false,
        "operationally_verified": false
      },
      "evidence": {
        "source_kind": "active_branch_project_state",
        "evidence_strength": "authoritative_for_branch_ownership",
        "repository": "anthonyedgar30000/helix-protocol-kernel",
        "observed_ref": "feature/edge-envelope-v0.3:.project/active-work.json#workstreams[edge-envelope-v0.3]",
        "observed_on": "2026-07-21"
      }
    },
    {
      "role_id": "contextos-pr13-owner-unresolved",
      "desired_chat_title": "[UNRESOLVED] ContextOS — PR #13 Query Bridge",
      "role_type": "unresolved_owner",
      "authority_state": "unresolved",
      "current_conversation_label": "ContextOS vs HELIX",
      "owned_repository": null,
      "owned_branch": null,
      "target": {
        "repository": "anthonyedgar30000/ContextOS",
        "branch": "feature/helix-query-bridge",
        "pull_request": 13,
        "head_sha": "98d268198465bcea6b73cdf552732acc9e5f4246"
      },
      "current_status": "open_mergeable_no_repository_native_active_work_owner_no_exact_head_ci",
      "allowed_actions": [
        "repository_read",
        "ownership_resolution",
        "read_only_review"
      ],
      "prohibited_actions": [
        "repository_write",
        "branch_ownership_claim_without_handoff",
        "pull_request_merge",
        "ci_workflow_claim",
        "cloud_mutation"
      ],
      "lifecycle": {
        "proposed": true,
        "implemented": true,
        "ci_verified": false,
        "merged": false,
        "deployed": false,
        "operationally_verified": false
      },
      "evidence": {
        "source_kind": "live_github_metadata_and_missing_project_state",
        "evidence_strength": "authoritative_for_unresolved_status",
        "repository": "anthonyedgar30000/ContextOS",
        "observed_ref": "pull/13 plus missing feature/helix-query-bridge:.project/active-work.json",
        "observed_on": "2026-07-21"
      }
    },
    {
      "role_id": "modern-agent-protocols-archive",
      "desired_chat_title": "[ARCHIVE] HELIX — Modern Agent Protocols",
      "role_type": "superseded_reference",
      "authority_state": "handed_off",
      "current_conversation_label": "Modern Agent Protocols",
      "owned_repository": null,
      "owned_branch": null,
      "target": {
        "repository": "anthonyedgar30000/helix-protocol-kernel",
        "branch": "feature/edge-envelope-v0.3",
        "pull_request": 4,
        "head_sha": "28ad96e63baf6e3cc5e5d5a0059bb56f7ec227f3"
      },
      "current_status": "ownership_handed_off_to_protocol_kernel_conversation",
      "allowed_actions": [
        "historical_reference",
        "read_only_context"
      ],
      "prohibited_actions": [
        "repository_write",
        "branch_ownership_claim",
        "pull_request_merge",
        "cloud_mutation"
      ],
      "lifecycle": {
        "proposed": true,
        "implemented": false,
        "ci_verified": false,
        "merged": false,
        "deployed": false,
        "operationally_verified": false
      },
      "evidence": {
        "source_kind": "recorded_ownership_handoff",
        "evidence_strength": "authoritative_for_handoff",
        "repository": "anthonyedgar30000/helix-protocol-kernel",
        "observed_ref": "feature/edge-envelope-v0.3:.project/active-work.json#ownership_handoff",
        "observed_on": "2026-07-21"
      }
    },
    {